{
  "event_id": "b2c3d4e5-f6a7-8901-bcde-f12345678901",
  "event_type": "INJECT_DENIED",
  "event_category": "inject",
  "event_time": "2025-01-15T14:31:00.789Z",

  "agent_id": "agent.marketing-assistant",
  "agent_name": "Marketing Assistant",
  "org_id": "org.finco",
  "org_name": "FinCo",

  "context_id": "ctx-001",
  "context_name": "context.trading-limits",
  "version_id": "",
  "version_number": 0,

  "prompt_id": "",
  "prompt_name": "",

  "governance_hash": "",
  "hash_type": "sha256",
  "trace_id": "661f9511-f3ac-52e5-b827-557766551111",
  "data_classification": "confidential",

  "template_rendered": false,

  "denial_reason": "Agent agent.marketing-assistant is not linked to context context.trading-limits",
  "violation_type": "ACCESS_CONTROL",
  "severity": "medium",

  "source_ip": "10.0.1.55",
  "request_method": "GET",
  "request_path": "/api/contexts/trading-limits/content",

  "ingested_at": "2025-01-15T14:31:01.234Z",

  "metadata": "{}"
}
